{
  "contract_version": "registry-publication-authority/0.1.0-draft",
  "authority_id": "example-registry-publication-authority-001",
  "authority_purpose": "calendar-registry-publication",
  "authorized_subject_type": "calendar-registry-snapshot-publication",
  "authorized_subject_sha256": "ca116e96ffab5326be710cf95b2033749986da8bbe60900282d53f84a61929f2",
  "registry_id": "example-calendar-registry",
  "snapshot_id": "example-snapshot-2099-01-v1",
  "scope": {
    "run_id": "2099-01-r99",
    "consumer_id": "calendar-renderer",
    "programme_month": "2099-01",
    "registry_purpose": "calendar-authority-resolution"
  },
  "owner_authority": "example-registry-owner",
  "decision_reference": "example-owner-decision-OD-2099-001",
  "issued_at": "2099-01-04T09:00:00Z"
}
